{
    "computational_environment": {
        "time_limit": "00:30:00",
        "memory_limit": "16G",
        "partition": "batch",
        "cpus": 8
    },
    "test_input": {
        "function_name": "Deuflhard",
        "sample_range": 1.5,
        "reduce_samples": null,
        "degree_max": null,
        "precision_params": null,
        "dimension": 2,
        "center": [
            0,
            0
        ],
        "GN": 100,
        "noise_params": null,
        "tolerance": null
    },
    "critical_point_analysis": {
        "hessian_tol_zero": 1.0e-8,
        "tol_dist": 0.001,
        "enable_hessian": true,
        "max_iters_in_optim": 100,
        "bfgs_x_abstol": 0,
        "bfgs_f_abstol": 1.0e-8,
        "verbose": true,
        "bfgs_g_tol": 1.0e-8
    },
    "metadata": {
        "function_name": "Deuflhard",
        "computation_id": "dc98cad7",
        "tags": [
            "deuflhard",
            "2d",
            "chebyshev",
            "degree8",
            "quick"
        ],
        "timestamp": "2025-08-07T10:22:24.568",
        "description": "Quick test with minimal parameters - deg8_chebyshev_quick",
        "job_type": "quick"
    },
    "polynomial_construction": {
        "normalized": false,
        "precision_type": "RationalPrecision",
        "verbose": 0,
        "power_of_two_denom": false,
        "degree": 8,
        "basis": "chebyshev"
    }
}